user_id,timestamp,text
iceplaysmusic,1596673528,"Here is my video of what I did after I found my lump. Hopefully it helps!! :)


https://youtu.be/PeF2KnIDe50"
thornsandroses,1562964077,[removed]
clickityClank_,1532206925,"About 2 weeks ago I was playing on the floor with my son and noticed pain in the left part of my chest under my nipple. I immediately stood up and felt the area and found what seems to be a round mass that is sensitive to the touch. I went to the doctor and after insisting it be checked, got her to schedule a mammogram. I have hardly been able to sleep since I found it and am super nervous about my mammogram appointment tomorrow. The lymph node under the left side of jaw feels super swollen. I know I should just wait for the doctor, but I'm freaking out a bit. Are there any other symptoms with breast cancer in men? I don't have any discharge or anything. Thanks in advance."
Secure_Physics,1545849164,
trock3,1491172604,
summatimesadnezz,1558640470,[removed]
doeatmypoop,1550656632,"Hi, I wanted to ask if anyone here had these symptoms before they found out they had breast cancer? 

My mom has been fighting breast cancer for a long time and I am a bit worried because I feel weird on my left breast. 

That breast has felt weird for about two years, I always had sharp pain that came and went out nowhere. But since December that the pain has been getting worse. Now I feel a burning sensation on it all the time and when the sharp pain comes it’s a lot stronger than it was before.
The burning sensation has also moved on the upper, left side of my back (right behind my breast). And since a few days a red mark appeared on the breast...

I have tried to find all kinds of excuses for this for a long time, because I am afraid of cancer. I have seen how it has destroyed my mothers life... 

But I finally decided to go a doctor and I had waited for a month for that appointment and when I told her about what was going on, she didn’t even see my breast. She didn’t even touch me. Nothing. She stood up like a meter away from me and looked at me as if I was crazy :( and then the only thing she said was that I needed to go to a gynecologist for that problem...

But here in my city is impossible to find an appointment in a gynecologist. They don’t want to take any new patients and I have insisted and called all of them, but they don’t want to take me or tell me to call again in a couple of months, haha. And the appointments then (if they even want to be give me one) are months away... 

I am sorry to complain, I just want to know if I am just overthinking this, has anyone also had the burning sensation/sharp pain/marks on the skin of the breast?... "
lowunn,1589086766,Tomorrow is Mother’s Day and I want to make her breakfast in bed. She is doing chemo right now (4 rounds so far). What can I make her? What will taste normal? What won’t make her nauseous? I want to make tomorrow really special because she is having a really rough time. What else can I do (without food)?
pamandjimmybabies,1575524327,"hey so im quite worried, I hope im in the right place. I don’t know much about breast cancer or what to look for just the basic signs and my nipple in my left breast has suddenly sunken and there is a mostly painless lump right below? im only 17, i started birth control about a month ago and I am on my period but this has never happened to me and I don’t know if it’s a normal side effect of my birth control or period or something I should get checked out ASAP, should I wait until after my period has ended to see if the problem goes away or should I mention it my mom now? :("
PocketRocket3,1598940491,"I (34F) recently found a lump in my left breast after having a lot of pain in my nipple. I had an US done and mammogram and they found hypoechoic masses in both breasts and two swollen lymph nodes in my left arm pit. 
As i have a family history of breast cancer I am freaking out. I’m scheduled to have biopsies and aspirations done in a week but all I can think of is that its cancer. 
I have two young children and trying to stay positive but it’s hard not to think the worst. 

Would love to hear stories of others who have had similar situations as myself. 

TIA x"
medfaw123,1547323551,
accountingnerd4,1602089149,When waiting for genetic results were you told by your doctor or genetic counselor first? My doctor called to set up an appointment to go over the results but last time I spoke with my GC she said she would reach out once they received the results as well. Not sure if it means anything to hear back from my doc first. Thank you ladies!
dmscvan,1597120481,[removed]
creambanded,1579226366,"Hey--I'm about to have a breast ultrasound later and I just kind of wanna have reassurance? 

So around last week of September last year I began to feel a pain on around under my left breast? I got it checked on October and everytime the doctor--or I would press the part it hurts but there's no huge lump there or anything, more like a jelly type? It's not hard but more of a soft lump? 

I failed to get it check for follow up ultrasound last year since I got busy and I just had the free time for it. Now I'm nervous as hell and getting paranoid huhu. 

So randomly at times I would feel it--I can't feel any hard lumps, like nothing's even there! It's just everytime I press a bit hard on a certain part I can feel the pain. I can't see anything closely similar on google so I don't really have an idea what this is! I thought it was gone a couple of days back but I guess it's still here. 

Any idea what this may be?"
kinseve,1569466525,"My breast ultrasound results says 

birads category:
prob. benign findings; short interval ff-up suggested (left breast)"
SisUsiS,1595756950,"I’m scheduled for August 4th and curious about finding some other “Flatties.” Going flat was an easy decision for me due to my age (50, post menopause) and myriad other other medical conditions. Now that it’s the direction I need to go, I’m actually looking forward to saying goodbye to “the girls.”

There are some great advocacy/awareness websites and podcasts out there. I’d love to hear about people’s recovery times and processes from going flat."
jerdin95,1579816756,
Poopermensch,1561588911,[removed]
concerned1988,1572581162,
paragobabuji,1528968707,
foryourbreast,1593633969,
Tubbygoose,1596391673,"I’m struggling with my google-fu, but I figure y’all would know better anyway.  

1) what is the difference between stage and grade?  My surgical oncologist said I am stage 2b grade 2 ER+, PR-  HER2+.  I’m not sure how they would know what stage I’m at yet since I just had my lymph node biopsy and MRI on Friday and do not have yet results yet.  How does that work?  The tumor is 2.1cm.

2) this one is a dumb one, but is it frowned upon to shave my head before chemo starts?  I start herceptin, perjeta, taxotere, and carboplatin on 8/11.  I tend to getting nauseous and tired from regular medicines so I am anticipating getting sick.  I would prefer to get the head shave out of the way before I feel like crap.  Is that weird?  Or is it just whatever you are comfortable with?"
Holly_Golightly39,1599625469,"Aunt diagnosed with breast cancer, getting a double mastectomy. What kinds of things should I put in a basket for her?"
antoniolens92,1573148573,Mom just had Surgery to remove the Tumor from her Breast after all the chemo now they are saying they have to do surgery in the same spot 😞
Koalio15733,1594757064,"TL:DR I have a large lumpy growth and I'm getting it biopsied tomorrow. I could use some advice and support as I don't really have family to go to.

Hi everyone! I feel the need to share my story so far. I am 42 going on 43 this year so I hadn't had a mammogram yet. If anyone has advice I would greatly appreciate it. 2 months ago I saw that I had a bruise on my left breast that came out of nowhere. I know I hadn't bumped it or had one of my critters jump on it. I am notorious for having random bruises though and didn't think too much of it at the time. I checked it again after almost a week and the bruise hadn't changed in any way. That's when I started feeling around on it. Directly below it was a hard lump. I told my husband (he's a nurse) the next day when he got home. We both felt it and knew it needed checking.

Due to Covid and crippling social anxiety it took me two months to get an appointment with my GP to get a referral for a mammogram. That was 2 weeks ago. During that exam by her she found a second small lump in my right breast. During the 2 month time period between finding the lump and seeing my doctor, I started to have increasing soreness and pain in my left chest/breast and down my arm. I do have angina, but this was different. The place that the pain was in was more my chest wall than interior in my chest. My GP scheduled me for a mammogram and sonogram ASAP, and referred me to a breast specialist/oncologist.

That was done last week. The right lump is small with diffuse edges and the radiologist said it's a 50% chance that it is a growth of some kind. The left lump is very large, very dense, and has sharp edges in a cauliflower like pattern. The ultrsonographers and the radiologists faces were grim when looking at it. He said he gives me an almost 100% chance that it is a tumor. They said I needed a biopsy ASAP. I already had a follow up appointment scheduled with the specialist for tomorrow. Since my appointment last week I have been called by all 3 places about getting the biopsy done as soon as possible. So I see the specialist tomorrow and have the biopsy scheduled at her surgery center for right afterwards.

I'm not going to lie, I am scared. I am almost positive that it is going to be malignant. I have relatives on both sides of my family that had breast cancer. I know that my mom's Aunt died from it. My mother had uterine cancer when she was about my age. She also had at least one benign breast tumor. 

I don't really have much family support. Both my mother and both husband's parents have passed. My dad remarried only 4 months after my mother passed. He has since alienated me for various reasons. One of which being that he continues to hold parties for all of my stepmother's family during covid. So I'm honestly scared to be around him because I can't afford to get it. I already almost died from bronchitis once when I went into septic shock. I am also disabled due to multiple car accidents effing up my back pretty badly. So I'm not able to do much or go out much. 

The one great shining light is my husband. He is the best support anyone could ask for. He is very stoic and doesn't show fear or hurt very much. He is ex military so fear is a weakness, lol! He also works 60 hours a week just to support us, so I don't have as much time with him as I would like. I know that he is scared out of his mind too. We are only going on our 10 year anniversary being together this year. Without him, I don't know how I would be right now. 
 
I apologize for the length of this. I just needed a place to tell the story and hopefully get some ideas of how to go about navigating this. Thank you for reading this."
MidWestRRGIRL,1567948822,
alesun24,1507813927,Any recommendations on things I can do or buy for her to make her more comfortable post op?  Planning on taking on some chores around the house and doing some cooking. But looking for any products that you guys would consider “must haves.”  Much appreciation in advance. 
angryreceptionist,1552527618,"Hi - first time poster here. I’m 32, and have a family history of BC (both grandmothers, two aunts on my mothers side). 

For the past two months, I’ve had a strange, sometimes-stabby sometimes-dull pain in the top part of both of my breasts. At first I thought it was due to hormonal changes, but the pain has been semi-constant throughout My menstrual cycle. No lumps, though. 

Additionally, my breasts have been (for lack of a better word) - changing direction? My right boob seems to be facing more “upwards” lately...

Also I’ve been noticing a weird dimpling with my nipples...

I’ve made an appointment with my GP next week. I know that for a woman at my age, the risk is low - and it can be so, so many other things - 

But god damn it I’m scared. 

Am I being weird? Or irrational? Or crazy? 

"
demila1330,1532636881,"Will be having mastectomy and chemo soon. It's up to me which I do first. Any thoughts regarding benefits of doing  one or the other first would be appreciated. 
Lumpectomy 5 years ago. 
1.4 cm, Invasive, agresssive HER2+, ER/PR- now. 
Would have immediate reconstruction using my own fat/tissue. 6 rounds of TCH(P)."
lost-vulpecula,1602382408,"Hello again, everyone, finally starting to feel better after cycle two of  TCHP chemo and now I've got questions regarding some things.

First, what does it mean when people say chemotherapy side effects are cumulative? Are things going to get worse with each one? Or is it on a case-by-case kind of thing?

Second, I've suddenly developed indigestion, which I've never in my life experienced and makes it impossible to eat normally - is this a side effect of the chemos or something I should be looking into elsewhere (will be asking about it regardless, but curious all the same)

Third, this chemo mouth...what can I do about it? Everything is slimy, tastes metallic, or feels like licking a battery! Does it go away farther from the infusion or does it just stay eventually?

Fourth, are aggressive mood swings normal? No one mentioned anything about any kind of emotional affects, so I'm not sure what can be expected and what is out of the ordinary!

And finally, what can I do about my skin? The hair is already a loss, and to some degree I've accepted that, but my skin is freaking out. It's behaving like I've had a sunburn or something, I'm really not sure how to explain it other than dry, peeling, and angry.

Thank you for any answers, it's comforting to know that I can ask here for first hand experiences"
compliKATIEd,1590313066,"Found a lump like.. 2-3 weeks ago, got to the obgyn and then a radiologist who told me its probably a fibroadenoma, but that she cant diagnose anything without a biopsy so she referred me to a surgeon/oncologist. He gave me 2 options of whether to cut the lump and then we'll know or if I'd like to do tests. Was really put on the spot and had to answer in 4 secs so I opted for tests. The 2nd radiologist whilst doing the ultrasound blurted out ""its probably malignant"" and took biopsies.                    That was on friday, and Ive just been going crazy with overthinking and I dont get my test results until Tuesday."
Party_Time_Gringo,1591270459,
calliemhart,1595023765,"Certain inherited gene mutations can put you at an increased risk of developing one or more cancers in the future, but knowing you have these mutations can help personalize your preventative care, and help you manage your future cancer risks. Out of the following 11 gene mutations, BRCA1 and BRCA2 are the most researched, and have been linked to hereditary breast and ovarian cancer syndrome, which put women at increased risk of having multiple breast cancers, as well as ovarian cancer in a lifetime. However, having one of these mutations doesn't guarantee you will develop cancer.

For those who have already been diagnosed with one or more cancers, multi-gene panel genetic testing may be a useful resource for you to understand your risk of future cancers, diagnose possible hereditary cancer syndromes (ex: HBOC and Lynch syndrome), learn of opportunities for targeted therapies, and discover inherent risks to children. Staying informed can lead to early detection, prophylactic surgeries, and curated treatments. If you want to learn more about multi-gene panel genetic testing, I will provide a CLIA certified resource through Concierge Health: [https://kit.myconciergehealth.org/cgx?a=adv](https://kit.myconciergehealth.org/cgx?a=adv). Something to remember as well: genetic testing for young people who have NOT been previously diagnosed with cancer may lead to impacted long-term insurances. GINA (The Genetic Information Nondiscrimination Act) protects against health-insurance and employment discrimination due to genetic information. I hope you all find this chart useful, I encourage you to research, discuss, ask questions, and stay informed!

https://preview.redd.it/13iqx8vkqhb51.png?width=646&amp;format=png&amp;auto=webp&amp;s=ed3d86202980ec567706108d89dfa166e124eb42"
Ritika97T,1557757061,
Mahiele,1586423485,
baddiedraper,1585257543,[removed]
slothmom2140,1551915927,"I get my “mobile” done on the 18th...what the normal time frame for then me to start? 
I am so impatient hahaha
If I had my way I would be already doing it...I had the double mastectomy on 1/23"
jesscamm,1568672408,"Hi. I am wondering how you chose your oncologists and what resources you used to look them up and see if they are good.

We are interested in getting a second opinion which would be with another surgical oncologist. Would we have to get another second opinion from a medical oncologist too?

So far we have seen the surgical oncologist the most (he did the biopsy, ordered MRI ect). We have just met the medical oncologist who chose the chemo plan. 

It’s so much easier to just trust the doctor that was given to us but would you say it’s worth it to get the second opinion? The doctors we have now aren’t in a cancer center with a team approach. Or will treatment be similar regardless?

Diagnosis: Stage IIa, grade 3, ER+PR+ HER2- tumor is 4cm, no lymph node abnormalities seen in MRI

Thanks in advance."
thepatientstory_TPS,1564155556,"Hey friends, I'm the content editor for The Patient Story - we're an online platform that shares stories of recent cancer survivors and caregivers in hopes of breaking up the medical jargon and statistics you find on Dr. Google. We hope to humanize the diagnosis for new patients. Go to [www.thepatientstory.com](https://www.thepatientstory.com) if you'd like to see what I mean!

We're starting a series of weekly articles and videos, and a few weeks from now I'll be writing about mastectomy tattoos. I'm trying to gather as many stories and perspectives as possible before then. If you or someone you know are interested, please feel free to message me!

&amp;#x200B;

Questions might include things like:

What led you to the decision?

Was it a cathartic experience?

Do you recommend getting them?

Did it hurt?

Etc. etc."
redditontheinterwebs,1585472309,[removed]
boolehealth,1550648496," Hello, we are a team of data scientists with family members that battled cancer. We have decided to compile illustrative stories based on public sources to craft stories of people battling cancer. We would love to hear the community's feedback.

[https://medium.com/@booleai/sarahs-story-battling-breast-cancer-d1bf1a39bf86](https://medium.com/@booleai/sarahs-story-battling-breast-cancer-d1bf1a39bf86)

In **July 2015**, when Sarah had just turned **42**, she felt a lump in her right breast. She thought it was just benign, similar to lumps that her mother and aunt developed around her age. However, when she consulted her doctor, she was advised to get tested. Both her **mammogram and ultrasounds** came out to be normal. Sarah still felt that there was something wrong with her. However, it eventually proved to be quite a difficult task to convince her doctor to conduct a **biopsy**.

After convincing her doctor to do the test, Sarah was diagnosed with bony metastasis and visceral metastasis to lung and liver, and she was already at **Stage 4**.

At first, Sarah had to undergo a **bilateral mastectomy**, which was later accompanied with all sorts of complications including an MRSA infection. Sarah had 4 cycles of ***Taxotere*** and ***Cytoxan***.

Sarah suffered from skin rashes and high fever, after her chemotherapy. Since her liver enzymes were at an elevated level, her chemotherapy got delayed. Moreover, her **alk phos** was **801** and **ALT/AST** was **5–6 times** normal.

Unfortunately, cancer did not respond to chemotherapy and it failed to shrink or regress. Then Sarah was started on **hormone therapy** with ***Letrozole***, but it resulted in her cholesterol levels increasing dramatically (e.g., **LDL 220** and then **290**).

In **August 2017**, the radiologist identified enlarging intrathoracic lymph nodes. Her doctor recommended **bronchoscopy**with biopsy of a lymph node, and the pathology report came back as **metastatic breast cancer**, still 100% ER+, 20% PR+, **Her2 negative**. The treatment with ***Letrozole*** was continued for almost **2 years**.

As a result, ***Letrozole*** was discontinued and she was put on ***Faslodex*** and ***Ibrance***. Since Sarah was already suffering from osteoporosis, therefore, the doctor started ***Xgeva***. Sarah was given ***Xgeva***, as an injection under the skin, after every **four weeks** but it made her feel miserable for several days. The most side effects that Sarah experienced after having ***Xgeva***shots **were jaw pain, shortness of breath and unusual muscle or bone pain.**

Within **3 months**, the only cancer evident on CT scans was an 8 mm lesion in her thoracic spine. Sarah was able to stay on the highest dose of ***Ibrance*** for about **11 months**. Scans remained stable and her liver function tests also returned to normal. Even **transaminases** normalized after **3 months**. Her **alk phos** levels also dropped to 128 after two months and they continued to show a considerable decrease over the next **two months**. ***Faslodex***, ***Ibrance*** and***Xgeva*** were continued for more than a year.

The doctor told Sarah that the hot flashes and menopausal-like symptoms were due to hormone therapy (***Letrozole***followed by ***Faslodex***). Although, Sarah had shown great progress with ***Ibrance***, she experienced some side effects as well. These side effects included some **hair thinning, fever and mild fatigue**.

Moreover, it was observed that **both her platelet counts and white blood cell counts (especially neutrophils) had lowered**. ***Ibrance*** also elevated liver enzymes. Sarah managed to stay on ***Ibrance*** for **11 months** and avoided bone marrow toxicity. She had a reduced dose of ***Ibrance*** 100 mg.

Her isoenzymes were elevated for liver, bone, and intestine in **2015**, but after treatment with ***Letrozole, Ibrance, Faslodex and Xgeva***, there was a tremendous decrease in her isoenzymes levels in **2018**. Sarah is really happy now to have a normal alk phos and she is even hopeful that the normal value means her bone disease is stable and dormant.

Apart from the aggressive cancer treatment, Sarah was also prescribed to have a healthy and balanced diet, with **fruits and vegetables and yogurt**. The diet itself made Sarah feel a whole lot better.

The entire experience of going through the treatment was really difficult not only for her but also for her entire family. Sometimes, she would be really depressed and on some days the pain would be unbearable. But she had her family by her side to support her emotionally.

**About Us:**

We are a team of MIT-educated professionals who have loved ones that battled cancer. Our goal is to apply the latest data science techniques to extract stage of cancer, drugs and side effects to bring personalized medicine to the patients. While we know that all cancer patients are unique, giving insight to patients with similar characteristics and disease pathologies could help inform decisions during difficult times.

**Disclaimer:**  
This is an illustrative narrative that was gathered from publicly available sources. Details of name, age, location, and other identifiable information were altered to protect anonymity. Otherwise, all medical information provided is accurate as Boole could interpret.

The Information is made available on the understanding that the Boole Health shall have no liability (including liability by reason of negligence) to the users for any loss, damage, cost or expense incurred or arising by reason of any person using or relying on the information and whether caused by reason of any error, negligent act, omission or misrepresentation in the Information or otherwise."
astorkha,1527667421,"Recently I noticed changes in my left breast. I've had lumps before and had an exam many moons ago. There's a knot in my left breast where I also noticed a rash like circle under the breast and nipples are scaly. I looked up those exact symptoms and it lead to breast cancer pages. My aunt (father's sister) died at 35 of breast cancer. I qualified for an early detection program but now they're telling me I can't be seen because I'm not 50+ in age. Yet I have an immediate family member that died from it.... literally makes no sense and having this uncertainty is really messing with my emotions. Can anyone provide information on where I can go to get checked that I can qualify for being a broke joke.. I have absolutely no money to my name and no relationship with my family. Me against the world..... 

Please and thank you in advance for any stranger's kind help!!!!!"
Dostoevskybot,1562845377,"So today marks my last dose of AC chemo before switching over to T. AC has been a lot harder than I expected, really kicking my butt with all the side effects, so I am scared of chemo today but so happy that this is the last AC. (I was diagnosed with stage 1 triple negative breast cancer)."
mjan2010,1503432445,
