user_id,timestamp,text
shooter-mugavin,1569857155,"Doctor said Biopsy was confirmed to be cancer with Lymoh node inflamed.

This is all we've been given for the last 5 days- the wait has been torturous while not knowing what or how to approach our young daughter's with the news.

Today is our first appointment and my wife is terrrified- she wants to ""run away"" (essentially 5 days if constant fight or flight response).

I will be bringing a notebook but what exactly should we expect?
Blood tests? Genetic tests? CAT scan?
How is staging determined etc?

We are lost."
lezzieknope,1557863672,[removed]
dmrunnergirl,1591970935,"I had a double mastectomy and reconstruction three years ago. I have always heard that I should never do push-ups or chest exercises. I would ask my doctor but he doesn’t believe women should ever try to strengthen their arms, upper body anything so I know his answer. What do you all think? Is it ok to do push-ups and not “ruin” the reconstruction/implants?"
emomooney,1530521416,"Hi. 

So, I found this out yesterday, I'm pretty poor at emotions and the like. So I mostly just shut down. I feel selfish. I am pretty scared. So far we don't really know anything, just that she has surgery on Thursday and will probably be home by Sat, and then we wait two weeks for results from that before knowing what the plan is with chemo and radiotherapy. 

I know everyone's recovery is different, but I really think she is trying to soften it for us, which I understand. Telling me to just be around on Saturday and then go back home on Sunday. I feel like this is a massive surgery, she is getting reconstruction done at the same time. I just want to be realistic and be able to take the time off work ( I live a few hours away and can't drive ) to be able to care for her. It is likely that she won't be able to do anything at all for about 4 - 6 weeks right? She is fit and healthy in general. 

Has anyone gone through this? What should I expect, obviously making food, taking care of house things that is all pretty clear to me. But other things, will she be able to move at all? Will she be able to walk up stairs? I feel like we kind of know what to expect with chemo, but I think the recovery from the surgery is going to worse than we expect. "
danupama841,1527139420,
Jtrem714,1593975299,"Originally, posted about my wife's diagnoses here back in January. 

The initial scans showed that she had 3 suspected lymph nodes (Both via PET/CT and Ultrasound) The Main mass was biopsied and was high-grade Triple negative. However, no biopsy on the nodes. 

After 6 founds of AC chemo with Taxotere. 

She underwent a Single Mastectomy with Sentinel node biopsy.

Good news all 4 nodes removed during the surgery were negative. However, the main mass remained at the same size 4cm total. 

The surgeon was able to get clear margins all the way around. No impact on chest wall muscle what so ever. 

Now here is where we are getting the confusion. The oncologist isn't recommending Radiation. Since there is no impact on the nodes according to the biopsy during the mastectomy. 

However, we had a consultation with the Radiation Oncologist and they are pushing to do radiation given that they suspected impact on the lymph nodes during the initial diagnoses and the fact that the main tumor still remained and was high grade. 

Anything, I have researched showed no benefits with doing radiation on node-negative mastectomy with a tumor under 5cm total and with clear margins. 

In this case who wins out? My wife and I are confused and wondering if we should seek another opinion on the matter with another Radiation Oncologist."
CrazyLana,1565364051,
kingscheta,1506884894,
jlorader747,1577070697,[removed]
Muffinman1111112,1562824798,
NewsUpNow,1590441131,
IamMalkiYah,1539976559,"Hello, 

My name is MalkiYah and I am a photographer in the Metropolitan Detroit (Michigan, USA) area. The saying ""a picture is worth a thousand words"" can be so true. So I have been drawn to do some ""Photography Series Projects that will say a thousand words!

I am doing a series on physical scars on women. Why am I doing that? Because society determines a woman's beauty by her physical appearance and if she has any flaws she is devalued in some way. I empathize because even as a man I experienced a bit of that after my motorcycle accident in 2004. The scars from my bike landing on my right leg and then being drugged for 50 yards, get a certain look when people see them when I'm wearing shorts; you should have seen my leg before it healed . So I can just imagine what a woman goes through when she has a mastectomy, surgery or injury that causes her to have a major scar.

So how does this tie into my photography series? My mother had a double mastectomy and I remember distinctly her saying one day, ""so I lost my breasts, that's not going to stop me from living!"" I want to help women overcome that feeling that, that scar has taken their beauty! I want them to know that their beauty is so much deeper!

That is what this Photo Series will convey. 

So I am looking for women who live in the Southeast Michigan area that want to model displaying their scars to the world, proving that they have overcome the emotional &amp; psychological prison that the world places before them. If you are interested or knows someone interested in modeling (over 18 years old) please contact me @ iammalkiyah@gmail.com."
azhegazi,1521419341,
lananotdelreythough,1582693939,"Family history; my grandmother, my father's mother had breast cancer. i'm 20 years old now."
AVolpe1,1505271010,"please share, share, share this Facebook page to support an amazing family. 
Thank you,
God Bless"
JeanneMPod,1586548359,[removed]
CxSimpsAreAllFags,1601844728,
one_tit_wonder,1581889443,[removed]
alicesknickers,1570931272,[removed]
RyanAarav,1539150530,
thonioand,1540440750,
Watch4Hop-Ons,1602362367,"I completed chemo in May. My head looks pretty good—my hair is finally thick enough that I can go without a hat! The other day I used false eyelashes and loved them. First time I’ve felt beautiful in months. However, when I removed them and took off the liner (I used magnetic lashes), I pulled off a bunch of my natural lashes too. 

I loved the look of the false lashes, but I don’t want to cause additional damage to my natural lashes. Does anyone have any tips? I’m thinking about eyelash extensions but I worry about the damage with that too.

Any input is appreciated!"
makeupismySO,1519112945,"I was diagnosed with stage 3 IDC about a month ago. I have started chemo (DD AC-T) and I will have my last chemo session in May. My tumour is quite large, and my doctor has let me know that even if the adjuvant chemo is very effective, due to the cancer affecting the skin on my breast, a mastectomy is essentially guaranteed. 

I am fairly large chested (I wear a 36DDD) and regardless of the type of reconstruction I receive, my unaffected breast will need to be reduced. My question is: should I opt for a single mastectomy combined with reconstruction/reduction, or instead have a double mastectomy in hopes of a more symmetrical reconstruction? 

I’ve never been particularly fond of my breasts. They’re large and they swell for days before I get my period and my nipples are annoyingly sensitive. I am childfree, so I’ll never need to breastfeed anything. Given my lack of attachment (metaphorically!) to my breasts, which option is likely to give me the most symmetrical/aesthetically pleasing  results? I’ve looked for pictures of results of both approaches online, but I was hoping to get some personal experiences as well. My doctor is leaning more towards a single mastectomy combined with DIEP flap, but I’m just not sure I’ll like the results. 

Has anyone else faced this choice?"
Easygoing7356,1590257905,"Hi I've been extra worried as my mum has had BC and checking every little detail of mine recently, a few days I noticed what I can only describe as large blood vessel type things under the skin, one side feels bigger (but this side I have non stop been pokeing) but they are on both sides, any ideas? I'm terrified of the thought of calling my GP"
resister_sister,1579470763,[removed]
Ne0nLights,1535470158,"Short hand info: I found a lump a couple months ago, had a biopsy about a month ago, came back with benign breast conditions noted. Now the breast that was biopsied has swollen up and is hot to the touch and I'm worried it's not responding fast enough to antibiotics.  


Longer stuff:  
Has anyone had a core biopsy and had trouble healing after? I'm trying to be as positive as possible, but after a very tough time learning that I have benign conditions and family history that apparently predisposes me to higher risk of breast cancer, I'm feeling a little overwhelmed by what seems to be a secondary infection. About a week ago (maybe two, tops?) I noticed that my biopsied breast was warm to the touch and swollen. For the first couple weeks I left it alone as much as I could, though maybe I handled it too much, and I thought it was healing. I noticed my armpit was swollen as well, and my normally insensitive nipple suddenly had more feeling on that side. No redness, and the bruises healed up, but the pain and heat coupled with the swelling made it uncomfortable at best and painful at worst. I tried to stay calm, and went to a massage therapist last Friday thinking perhaps I'd been overworking and just strained my shoulder, as it is my dominant arm and I use it to work for several hours a day. She gave me a lymph massage, which helped drain it, but also noted it felt just like the mastitis her sister had while breastfeeding. I am not breastfeeding, nor am I pregnant, or having kids. So off I went to a GP yesterday, who prescribed me a course of antibiotics. She told me hormones sometimes cause fibroadenomas and seemed confused when I told her the technicians vaguely told me I had three out of nowhere, adenosis, apocrine metaplasia and haven't started any new birth control. I have not been on any hormonal medication in ten years. I just want to cry.

&amp;#x200B;

I'm a day in to my antibiotics course, and honestly, I'm not noticing changes. I think I'm a little less swollen in my armpit, but my breast is noticeably a bit larger, and still warm, firm, heavy and tender to the touch. I'm trying not to freak out, but I don't know exactly what to do... is this anywhere in the realm of normal? Could my breast just be finicky and still healing? Even scarier... what can I even DO if it doesn't respond to antibiotics?  


This is my first time finding breast lumps, my first biopsy, my first true realization that my risk factors are so high. I still want to go for genetic testing soon, but I'm broke, unemployed and having trouble working due to this. I live abroad and I am not eligible for unemployment or many government sponsored healthcare programs. It's terrifying, still. I'm trying not to let my mind reel, but everything I've read is about IBC and how infection is 'uncommon.' Even more frustrating, my gynecologist doesn't seem to have cared one shred about my email detailing this... I mean really, it's a month away from the biopsy and still causing me notable trouble, surely that's something to be aware of? She hasn't responded. I feel so alone.  


I don't know why this has been so hard, I'm just trying to stay positive and not assume the worst. I really hope in the next few days the antibiotics help, this has been such a painful couple months in an emotional and physical way. Thank you to anyone who listened, hoping everyone here is having a calm day."
PillHolder,1504037805,
LlamaLlamaNightyNite,1600293288,Has anyone had an infusion port inserted after chemo started?
Ladikillah80,1565557844,
WIPCorgi,1540250284,"My mother had an abnormality on her mammogram (after skipping them for four years... ugh) and got an ultrasound today. They found a 1cm thing and the radiologist told her at the apt. that it's ""probably cancer"" and scheduled a biopsy. What are the odds it's not? Kind of a long shot to hope but it seems strange to make that announcement before a biopsy. Thanks"
BrokenAshcraft,1586656688,"I had a 3d mam and an ultrasound on my right breast. The radiologist said they can't see anything on mam but see a ""irregular hypoechoic mass with posterior shadowing deep to the skin"" and they said it is 9mm wide and 5mm deep, does not say height. The radiologist said he thinks its a fat containing lesion but wants a biopsy. Birads 4

I have just a few questions!

1. How do you know taller than wide by feeling? Mine feels diagonal, from my nipple going towards my armpit but at a downward angle. Palpable and close to surface with no pain.

2. I've had this lump for 2 years and was told 2 years ago after ultrasound it was just dense breast tissue. Wouldn't it be obvious cancer by now if it was cancer?

3. Everything I've read says fat lesions are hyperechoic. How were your masses defined?"
statusconference,1595646409,"My previous post discussed the merits of no surgery v surgery to prevent very high risk of breast cancer. I've been talking it over with my mum a bit recently and am leaning more towards getting the surgery done, but have loads of questions. I'll have to have a chat with my breast specialist at the clinic and the surgeon, but thought I might be able to learn more here.

Has anyone here waited to have the surgery until they had lost weight? I'm currently obese and need to lose at least 25kg, which I would hope to lose before the surgery. I have weighed far less than I currently do at various points in my life, and would rather not go through something like that while also dragging all this weight around.

Has anyone had the double mastectomy and reconstruction done either simultaneously or fairly close together? How long did it take you to recover? 

If you had quite some time between the mastectomy and reconstruction, how much time did you have to wait?

For anyone who has had the mastectomy and reconstruction, does the hospital provide physical therapy assistance? I was reading earlier that you can't lift anything for weeks or your arms over your head for weeks. How do you wash your hair? What did you do for exercise?

What were the financial repercussions like? I am extremely fortunate to have landed within the Australian public healthcare system where it's going to cost me nothing, but I worry about the recovery time. If I have to take 6-12 weeks off work, I will have to plan accordingly. At what point did you return to work, if you worked in an office job?

What was your mental health like afterwards and during the recovery process? How did you deal with it all? Was it a fairly isolating experience, or did you have enough supports?

Thanks in advance for reading and anyone who answers any of the questions!"
BirthControlMethods,1589508570," HOW DO THEY TEST A BIOPSY FOR CANCER? HOW LONG DOES IT TAKE TO DO A BIOPSY OF THE BREAST?

 What is a biopsy?

The term ""biopsy,"" of course, does not apply only to the breast. It is a surgical procedure in which a part (incisional biopsy) or all (excisional biopsy) of any tumor, growth, cyst, flesh, or organ anywhere in the body is removed so that its nature may be determined by microscopic examination. The results of this examination, called the pathology report, indicate the exact diagnosis and help select the proper method of treatment, which may be further surgery, X-ray treatment, drug administration or no treatment at all. 

Link: [https://medicalquestionswithanswers.blogspot.com/2020/04/how-do-they-test-biopsy-for-cancer.html](https://medicalquestionswithanswers.blogspot.com/2020/04/how-do-they-test-biopsy-for-cancer.html)"
09Domer,1567023056,[removed]
LilyFriday789,1599416524,"I was diagnosed with DCIS intermediate grade with necrosis ER/PR+ in my left breast in March 2020. I was 30 at the time. I had two lumpectomies, 4 weeks of radiation. I’ve been too anxious to take tamoxifen and decided to give myself 6 months (so March till now) to decide. My wedding was postponed due to covid, I had IVF for embryo banking, and generally just felt overwhelmed with navigating health issues during covid. Anyway. I had my first 6 month post diagnosis scan 3 days ago. Mammo showed nothing, but the sonogram showed something. Radiologist said it wasn’t clear if it was scar tissue (it was close to the incision) or if it was something else. I felt like I was having dejavu in the room and panicked/froze in place. All I can think is that the radiologist looked horrified. I’m having a biopsy in 4 days (Thursday). I’m convinced it is going to be bad news. My anxiety is out of control when I’m alone or not busy with work. Help!!"
sciencenewsnet,1566209539,
MzOpinion8d,1568037542,[removed]
PurpleLadybug_6,1586741561,"One of my best friends was diagnosed with Stage 1A breast cancer recently. She opted for a mastectomy and underwent surgery about a month ago. Everything went well and her prognosis is wonderful--no chemo or radiation, and her doctor expects a full recovery.

However, she's still spending most of her time in bed, and that worries me. She's never been a bundle of energy, but from what she tells me, she's barely moving from her bedroom. She's taking a lot of pain medication and sleeps a lot during the day. I don't know if she's depressed or too dependent on the pain meds or something else. 

I've tried talking to her, but she's never been very open. Right now, because of stay-at-home orders, it's just her and her husband. He's a wonderful man, but not very good about addressing problems. He's also working from home to try to keep their health insurance.

Any advice on what I can do or say to my friend? Or should I stay out of it, keep in touch with her and see if she reaches out to me?

Thanks!"
Sunofshine,1598010716,
soswam,1588402837,"I figured this was the best subreddit to ask this to. 
I am 19F, no known health problems, and on 90-Day Birth Control (Daysee). I have no family history of breast cancer. 

About a year ago I noticed a lump in the upper right part of my right breast. I was concerned at first, but knew that with no family history and my young age with no other symptoms it was highly unlikely that there was any true concern. I have no other lumps that feel abnormal on either breasts. 

Now, a year later I have noticed the same lump again, but it is larger. I wasn’t actively feeling for it when I noticed it. Maybe the size of a small plum?  Fairly hard and sore to the touch. 

I have no other symptoms other than occasionally I will get sores on that same right breast but that could be nothing? 

I am a college student out-of-state so finding healthcare can be a struggle, but I am absolutely willing to seek medical professionals if this is a true concern that should be addressed and looked at."
meganchristine122,1568061518,[removed]
BoobTalkRadio,1585505748,Here is my latest Boob Talk Podcast discussing nutrition and boosting your immune system during COVID-19 [Boob Talk Show 3/27](https://www.blogtalkradio.com/survive365/2020/03/27/boob-talk-with-cynthia-rogers)
smellofroses12,1553469042,[removed]
Lisa3363,1598625020,I am a 57-year-old female who recently got diagnosed with DCIS stage  zero I’m due to have the Covid test on Sunday Monday two seeds implanted iTuesday’s my surgery I’ve never been so scared in all my life my surgeon seems to think that it’s all good I had two small calcification groups at 4 o’clock the one was completely remove with the biopsy and the DCS it was in my ducts  all the tissue around it came back benign she is  now suggesting that I may or may not have to have radiation and may or may not have to take the pill for five years is anyone else going through this I live in Pittsburgh and I’m going to be going to UPMC group
danguje,1592507352,"Hello,

I'm new to this forum but need some support. I just found out today that my mom's few rounds of taxol didn't work and that her tumors have been growing for the past 3-4 months. She has Triple Negative, Stage 4 Breast Cancer. I'm heartbroken as I quickly read up on the next treatment (eribulen), and it doesn't seem like it extends her life very much. She's in pain and has been adamantly trying to avoid neuropathy by wearing her ice packs during chemo, but apparently eribulen causes it as well. 

I just wish she could live so much longer. I want my baby to know her as he gets older. I can't help but to be overwhelmed with sadness right now. I had so much hope that taxol (chemo) was working. She said she might have even been able to feel it working and had a good feeling. I have modeled my life after her, she's my inspiration. I'm also heartbroken that I have to leave in a month for 5 months for mandatory job training. What can I do to get over my grief and help her to live her happiest life? Will she be miserable on this treatment?"
Hawkvand,1585625357,[removed]
kiki1983,1596228091,"Folks, I put up a post about a breast biopsy last week. I appreciate all of your honest responses. Had mine today. Felt the scalpel as I wasn’t numb yet, but the rest was ok. I bleed more than expected. 

Anyway, I just wanted to say thank you so much to all of you. I am rooting for you all and send you love and light. Keep going, you can do this. 

Results next week. I will update you. Much love to you my internet friends!!"
HonorableMention111,1601509102,"Honestly, going through chemo has kept me from really thinking about what I’m going to do here. I met with surgical oncology once at the beginning, and have an appointment with them again next week to start the surgery work-up. I just did Taxol dose 10 of 12 today, and surgery will be sometime in November. I’m 32, IDC in right side, +/+/-, no genetic link. I’m really leaning towards a double instead of just the affected side, but would love to hear others that made that choice. I know studies show it doesn’t reduce your risk of recurrence, but I kind of just want to be done with them. I do plan on reconstruction, and symmetry is playing a small part in my decision. Thanks in advance for your input!!"
danupama841,1527238888,
thehellwegonnadonow,1588940474,"hey so my mom just had her first round of chemo yesterday, usually she drinks a LOT of water, however, she hasn’t been able to really get it all out. She is feeling a bit of pain around her right kidney but not anything very painful. We are planing on calling the doctor but I was wondering if anyone else had this side effect and how did they treat it. Thanks!"
WorkingConnection,1552794764,"Hey. So just a random person here (F20). 

But my nipple has been flaking and peeling a bit recently. I thought nothing of it bc I currently have a psoriasis flare up on my hand. But upon reading, I found out it could be Paget’s Disease, a rare form of breast cancer. My breasts feel fine (I think). So I hope I’m just overthinking what the internet has to say. Any advice is appreciated. "
swordandspear,1503090565,
chelswhoelse89,1524593944,
DoctoralStudent0808,1565112623,"Please Note: Regarding comments on this post, researchers at Virginia Commonwealth University will use your comments below for RESEARCH purposes to learn about breast cancer survivors views on the mammography screening and follow-up care. By commenting on this post, you are giving permission to have your responses used in the research study. If you do not wish to be included in the research, do not comment on this post. Leaving comments and participating is completely voluntary, and we will NOT collect your name or any other identifying information. If you want to share your thoughts, experiences, and concerns anonymously, click “ [https://qtrial2019q1az1.qualtrics.com/jfe/form/SV\_a2CU3v8tasNzN2d](https://qtrial2019q1az1.qualtrics.com/jfe/form/SV_a2CU3v8tasNzN2d) ” to go to our online survey. Your responses will be kept confidential with researchers at Virginia Commonwealth University.

Questions about this project can be directed to:

**Megan Edmonds, MPH(**[**edmondsm2@vcu.edu**](mailto:edmondsm2@vcu.edu)**)   804-453-8210**

Please reply only if you are a breast cancer survivor:

Describe what type of barriers (personal, social, financial) you may have encountered post breast cancer treatment?

Were there any barriers that prevented you to schedule a yearly mammogram?

Were there any barriers that prevented you to schedule a physical exam?"
marycarey111,1486443203,
lady_dalek,1598673013,"I’m probably alone on this one and honestly it’s kind of dumb, but does anyone else get super irritated by “fuck cancer” as a general response?

My entire social media is talking about Chadwick Boseman right now, which is obviously a giant fucking tragedy and I understand that people need to grieve. But the automatic response of “fuck cancer” as a stand-alone statement starts to feel dismissive, almost. Is it just me?

I’m having a really hard time finding the right words for why it bothers me so much. This isn’t a good comparison, but it *almost* feels like if someone was talking about police brutality, and all you said in response was “fuck racism”. Like— yeah, okay, but also what else?

It just feels like dismissive, trite garbage and I’m frustrated with myself for getting upset about it without being able to properly explain why it’s upsetting me."
